{
  "name": "Cinema",
  "type": "ysws",
  "draft": false,
  "description": "Make a short story JavaScript animation using canvas, Get HQ-made caramel popcorn! (card grants for international folks)",
  "ys": "JavaScript Canvas Animation",
  "ws": "Popcorn",
  "extern": {
    "website": "https://cinema.hackclub.com",
    "slack": {
      "link": "https://hackclub.slack.com/archives/C0936AVS683",
      "name": "cinema"
    }
  },
  "timeline": [
    {
      "start": "2025-07-02T00:00:00-04:00",
      "end": "2025-07-07T11:59:59-04:00"
    }
  ],
  "ships": []
}
