{
  "name": "Dummies",
  "type": "ysws",
  "draft": false,
  "description": "Learn A New programming language, and build a project with it and Get a Book",
  "ys": "Learn A New programming language, and build a project with it",
  "ws": "A book of choice from dummies.com",
  "extern": {
    "website": "https://dummies.hackclub.com/",
    "slack": {
      "link": "https://hackclub.slack.com/archives/C096M3EV67M",
      "name": "dummies"
    }
  },
  "timeline": [
    {
      "start": "2025-07-26T00:00:00-04:00",
      "end": "2025-08-14T23:59:59-04:00"
    }
  ],
  "ships": []
}
