{
  "name": "Summer of Making",
  "type": "flagship",
  "draft": false,
  "description": "Build stuff. Get stuff. Repeat.",
  "ys": "A project of your choice",
  "ws": "Multiple prizes!!!",
  "extern": {
    "website": "http://summer.hackclub.com",
    "slack": {
      "link": "https://hackclub.slack.com/archives/C015M4L9AHW",
      "name": "summer-of-making"
    }
  },
  "timeline": [
    {
      "start": "2025-06-21T00:00:00-04:00",
      "end": "2025-08-31T23:59:59-04:00"
    }
  ],
  "ships": []
}
