{
  "name": "Authly",
  "type": "ysws",
  "draft": true,
  "description": "Build the weirdest auth, get a Security Key",
  "ys": "Weird Auth System for your App",
  "ws": "Security Key",
  "extern": {
    "website": "https://authly.hackclub.com",
    "slack": {
      "link": "https://hackclub.slack.com/archives/C0963JU3CSD",
      "name": "authly"
    }
  },
  "timeline": [
    {
      "start": "2025-07-17T00:00:00-04:00",
      "end": "2025-08-21T23:59:59-04:00"
    }
  ],
  "ships": []
}
