{
  "name": "Toolsmith",
  "type": "ysws",
  "draft": false,
  "description": "Build a AI extension (MCP tool), get $10 of AI credits.",
  "ys": "An MCP tool",
  "ws": "$10 of AI credits",
  "extern": {
    "website": "https://toolsmith.hackclub.com/",
    "slack": {
      "link": "https://hackclub.slack.com/archives/C094X38BFT5",
      "name": "toolsmith"
    }
  },
  "timeline": [
    {
      "start": "2025-07-09T00:00:00-04:00",
      "end": "2025-07-11T23:59:59-04:00"
    }
  ],
  "ships": []
}
