{
  "name": "Converge",
  "type": "ysws",
  "draft": false,
  "description": "Build bots, win prizes",
  "ys": "Discord/Slack/Telegram/Signal Bot",
  "ws": "Multiple Prizes",
  "extern": {
    "website": "https://converge.hackclub.com",
    "slack": {
      "link": "https://hackclub.slack.com/archives/C091UF79VDM",
      "name": "converge"
    }
  },
  "timeline": [
    {
      "start": "2025-06-24T00:00:00-04:00",
      "end": "2025-07-15T23:59:59-04:00"
    }
  ],
  "ships": []
}
