{
  "name": "Silicon",
  "type": "ysws",
  "draft": false,
  "description": "Design your own custom devboard and we'll fund it.",
  "ys": "Your own custom devboard",
  "ws": "Funding to make it!",
  "extern": {
    "website": "http://silicon.hackclub.dev",
    "slack": {
      "link": "https://hackclub.slack.com/archives/C090WQ9JBTM",
      "name": "silicon"
    }
  },
  "timeline": [
    {
      "start": "2025-06-21T00:00:00-04:00",
      "end": "2025-08-06T23:59:59"
    }
  ],
  "ships": []
}
