{
  "name": "Cider",
  "type": "ysws",
  "draft": false,
  "description": "Create an iOS/MacOS app and receive a $100 Apple Developer account to publish it.",
  "ys": "iOS/MacOS App",
  "ws": "$100 Apple Developer Account",
  "extern": {
    "website": "https://cider.hackclub.com",
    "slack": {
      "link": "https://hackclub.slack.com/archives/C073DTGENJ2",
      "name": "cider"
    }
  },
  "timeline": [
    {
      "start": "2025-05-25T00:00:00-04:00",
      "end": "2025-08-31T23:59:59-04:00"
    }
  ],
  "ships": []
}
