{
  "name": "Hackmate",
  "type": "ysws",
  "draft": false,
  "description": "Build a collaborative app, ship it, and get rewarded.",
  "ys": "An app where people collaborate",
  "ws": "$50 in credits or a Raspberry Pi 4 (2GB)",
  "extern": {
    "website": "https://hackmate.hackclub.dev/",
    "slack": {
      "link": "https://hackclub.slack.com/archives/C092HR1LG20",
      "name": "hackmate"
    }
  },
  "timeline": [
    {
      "start": "2025-06-25T00:00:00-08:00",
      "end": "2025-07-17T23:59:59-08:00"
    }
  ],
  "ships": []
}
