{
  "name": "Extensify",
  "type": "ysws",
  "draft": false,
  "description": "Build an IDE extension, get a keychain or anything from a selection of other prizes.",
  "ys": "an IDE Extension",
  "ws": "Multiple Prizes including: keychains, premium themes, ampcode credits, stickers for your chosen IDE, and a TabNine Subscription.",
  "extern": {
    "website": "https://extensify.hackclub.com/",
    "slack": {
      "link": "https://hackclub.slack.com/archives/C094H3V1Y81",
      "name": "extensify"
    }
  },
  "timeline": [
    {
      "start": "2025-07-03T00:00:00-04:00",
      "end": "2025-07-07T23:59:59-04:00"
    }
  ],
  "ships": []
}
